{
  "case_id": "seed-hallumix-0001",
  "source_name": "HalluMix",
  "source_url": "https://huggingface.co/papers/2505.00506",
  "source_type": "benchmark",
  "is_public_seed": true,
  "created_at": "2026-05-09T00:00:00Z",
  "domain": "multi_domain_hallucination_detection",
  "input_context": "Public benchmark for real-world hallucination detection across domains and task types.",
  "ai_output": "Model produces a response containing one or more real-world hallucinations.",
  "ai_confidence": null,
  "ai_reasoning_summary": "The response may appear realistic and internally consistent while still being factually wrong.",
  "human_override": "Human evaluation or benchmark labeling identifies the hallucinated content as incorrect.",
  "human_rationale": "The benchmark is specifically designed to surface and classify real-world hallucinations.",
  "failure_type": ["hallucination", "factual_error"],
  "severity": "medium",
  "final_outcome": "Incorrect content flagged and benchmarked as hallucinated output.",
  "reviewer_role": "benchmark annotator",
  "tags": ["hallucination", "real_world", "benchmark", "factuality"],
  "evidence_status": "source-confirmed",
  "example_granularity": "dataset-level",
  "notes": "This is a benchmark-derived seed record. Replace with concrete examples from the released benchmark if available.",
  "license_note": "Check benchmark release terms before copying example content."
}
