{
  "case_id": "seed-visco-0001",
  "source_name": "VISCO",
  "source_url": "https://visco-benchmark.github.io/",
  "source_type": "benchmark",
  "is_public_seed": true,
  "created_at": "2026-05-09T00:00:00Z",
  "domain": "visual_reasoning",
  "input_context": "Benchmark case from VISCO focused on critique and correction in visual reasoning.",
  "ai_output": "Model produced an incorrect reasoning or answer in a visual reasoning task.",
  "ai_confidence": null,
  "ai_reasoning_summary": "The benchmark is designed around cases where a model's initial reasoning appears plausible but requires correction.",
  "human_override": "Expert human annotators provide the corrected answer or critique target.",
  "human_rationale": "The corrected response reflects benchmark-supported expert annotation and revision logic.",
  "failure_type": ["reasoning_error", "incorrect_inference"],
  "severity": "medium",
  "final_outcome": "Corrected benchmark answer provided through critique/correction workflow.",
  "reviewer_role": "expert annotator",
  "tags": ["visual_reasoning", "critique", "correction", "benchmark"],
  "evidence_status": "source-confirmed",
  "example_granularity": "dataset-level",
  "notes": "This is a source-backed seed record derived from the public VISCO benchmark description. Replace with a row-level example when extracting from the benchmark.",
  "license_note": "Verify dataset/paper usage terms before copying benchmark items verbatim."
}
