{
  "case_id": "seed-human-confabulation-0001",
  "source_name": "Human Confabulation Benchmark",
  "source_url": "https://huggingface.co/datasets/cert-framework/human-confabulation-benchmark",
  "source_type": "dataset",
  "is_public_seed": true,
  "created_at": "2026-05-09T00:00:00Z",
  "domain": "multi_domain_qa",
  "input_context": "Public dataset containing question-response pairs across multiple domains, contrasting grounded responses with human-written confabulations.",
  "ai_output": "A plausible but incorrect or ungrounded answer to a question.",
  "ai_confidence": null,
  "ai_reasoning_summary": "The incorrect answer is confabulated in a way that can sound coherent despite lacking grounding.",
  "human_override": "A verified grounded response replaces the confabulated answer.",
  "human_rationale": "The corrected answer is grounded and verified rather than merely plausible.",
  "failure_type": ["hallucination", "ungrounded_claim"],
  "severity": "medium",
  "final_outcome": "Grounded answer retained as the correct reference response.",
  "reviewer_role": "dataset curator / verifier",
  "tags": ["confabulation", "grounding", "hallucination", "qa"],
  "evidence_status": "source-confirmed",
  "example_granularity": "dataset-level",
  "notes": "This seed entry is based on the public dataset description rather than a single extracted item. Replace with a concrete row after reviewing the dataset.",
  "license_note": "Confirm reuse terms from the dataset card before publishing copied examples."
}
