{
  "case_id": "seed-diagnostic-correction-0001",
  "source_name": "Diagnostic Error Correction Benchmark",
  "source_url": "https://www.medrxiv.org/content/10.64898/2026.02.22.26346832v1.full-text",
  "source_type": "benchmark",
  "is_public_seed": true,
  "created_at": "2026-05-09T00:00:00Z",
  "domain": "clinical_reasoning",
  "input_context": "Benchmark evaluating whether a model can detect and correct an incorrect diagnosis.",
  "ai_output": "A diagnosis or diagnostic acceptance that may be incorrect in a clinical scenario.",
  "ai_confidence": null,
  "ai_reasoning_summary": "Clinical reasoning can appear coherent while still anchoring on an incorrect diagnosis.",
  "human_override": "Expert clinical correction establishes the proper diagnosis or identifies the mistake.",
  "human_rationale": "Expert medical judgment and benchmark framing are used to determine the correct diagnosis.",
  "failure_type": ["diagnostic_error", "anchoring_error", "expertise_gap"],
  "severity": "high",
  "final_outcome": "Incorrect diagnosis identified and corrected under benchmark evaluation.",
  "reviewer_role": "clinical expert",
  "tags": ["medicine", "diagnosis", "correction", "expert_override"],
  "evidence_status": "source-confirmed",
  "example_granularity": "dataset-level",
  "notes": "This is a high-stakes seed record based on the benchmark description, not a specific patient case. Do not add identifiable clinical details.",
  "license_note": "Check publication and reuse terms before copying benchmark material."
}
